{
  "schema": "declawd.report/v1",
  "tool_version": "0.3.1",
  "operation": "clean-c2pa",
  "changed": true,
  "input": {
    "media_type": "image/jpeg",
    "byte_length": 134542,
    "sha256": "30189993e5e293b4bca928a07412d78e129108f73a257bf16dffbb8c9e7fdbb9"
  },
  "output": {
    "media_type": "image/jpeg",
    "byte_length": 38618,
    "sha256": "4539a9bcad1cceef0020fcaaaf97e9257cd9c72178992211286503b457c1839e"
  },
  "findings": [
    {
      "carrier": "embedded-c2pa",
      "class": "c2pa-jumbf",
      "byte_length": 95892,
      "disposition": "removed"
    }
  ],
  "requested_actions": [
    {
      "action": "remove-embedded-c2pa",
      "selector": "c2pa-jumbf",
      "matches": 1
    }
  ],
  "completed_actions": [
    {
      "action": "remove-embedded-c2pa",
      "selector": "c2pa-jumbf",
      "matches": 1
    }
  ],
  "verification": {
    "embedded_c2pa_absent": true,
    "non_c2pa_bytes_unchanged": true,
    "compressed_image_data_unchanged": true
  },
  "untested_channels": [
    "statistical token-choice watermarks",
    "pixel-level or perceptual watermarks",
    "remote C2PA references were not followed or removed",
    "soft bindings were not tested or removed"
  ],
  "warnings": [
    "A finding is not evidence that AI was involved.",
    "This tool does not detect or certify removal of Claude's watermark."
  ]
}
